{
  "schema_version": 1,
  "updated_at": "2026-08-03T20:48:17Z",
  "master_session_id": "S-MASTER-001",
  "sessions": [
    {
      "session_id": "S-MASTER-001",
      "thread_id": "019fc5d4-f360-78b3-b2a6-c8bae92df690",
      "title": "Tecmo R0 Master Finish Orchestrator - Sol Max",
      "role": "master",
      "model": "gpt-5.6-sol",
      "thinking": "max",
      "status": "active",
      "pin_state": "pinned",
      "round_ids": ["R0", "R0A", "R1A", "R1", "R2", "R3A", "R3", "R4A", "R4"],
      "task_ids": ["R0-CTRL-001", "R0A-INV-001"],
      "worktree": "C:/Users/joshs/Projects/tecmo-basketball-port-master-orchestrator",
      "branch": "codex/master-finish-orchestration",
      "base_sha": "63b29b04b1ab4745b7b8d5dd0499942d1bf8ba4e",
      "last_good_sha": "5b8a13b30620201bfbc99171f47727b5b593eed8",
      "reports_to_session_id": null,
      "parent_session_id": null,
      "reported_luna_lineage": [],
      "recovery_lineage": [],
      "failure": {
        "count": 0,
        "raw_error_signatures": [],
        "retry_session_ids": [],
        "replacement_session_id": null,
        "takeover_confirmed_at": null
      },
      "created_at": "2026-08-03T04:18:18Z",
      "completed_at": null,
      "updated_at": "2026-08-03T18:45:20Z",
      "notes": "Master owns coordination state, round integration, and main pushes; no product implementation or product QA. User-authorized incremental delivery subrounds R1A and R3A prevent accepted work from waiting behind unrelated parent-round tasks. Capacity target is four active domain Sols plus bounded Integration QA Sols within the eight-session monitoring limit. A second master is recovery-only to prevent split queue/merge/push authority."
    },
    {
      "session_id": "S-SOL-R1-GAMEPLAY-DUP-001",
      "thread_id": "019fc61d-62f6-7fc3-b94e-e9c301a092c1",
      "title": "Tecmo R1 Gameplay Foundation Duplicate Sol Max - Replaced",
      "role": "domain_orchestrator",
      "model": "gpt-5.6-sol",
      "thinking": "max",
      "status": "replaced",
      "pin_state": "unpinned",
      "round_ids": ["R1A", "R1"],
      "task_ids": ["R1-CPU-PLAY-LIFECYCLE", "R1-LIVE-FOUNDATION", "R1-TIP-FIDELITY"],
      "worktree": null,
      "branch": null,
      "base_sha": "6d8f9c7a99a7ce188f1a523247d3a9b9093860fb",
      "last_good_sha": "ad0f005673692b04772bce3c3b4d3ac4b2624731",
      "reports_to_session_id": "S-MASTER-001",
      "parent_session_id": null,
      "reported_luna_lineage": [],
      "recovery_lineage": [],
      "failure": {
        "count": 1,
        "raw_error_signatures": ["codex_app__create_thread returned: Something went wrong while running this tool; registry inspection proved the thread was nevertheless created"],
        "retry_session_ids": [],
        "replacement_session_id": "S-SOL-R1-GAMEPLAY-001",
        "takeover_confirmed_at": "2026-08-03T05:36:28Z"
      },
      "created_at": "2026-08-03T05:34:02Z",
      "completed_at": "2026-08-03T05:36:28Z",
      "updated_at": "2026-08-03T05:38:00Z",
      "notes": "Launch false-negative caused a duplicate retry. It acknowledged authoritative takeover by thread 019fc61e-0f2a-7fb0-a76e-e4676808c959 and reported no worktree, branch, Luna, edit, commit, test, proof, or repository mutation."
    },
    {
      "session_id": "S-SOL-R1-GAMEPLAY-001",
      "thread_id": "019fc61e-0f2a-7fb0-a76e-e4676808c959",
      "title": "Tecmo R1 Gameplay Foundation Domain Orchestrator - Sol Max",
      "role": "domain_orchestrator",
      "model": "gpt-5.6-sol",
      "thinking": "max",
      "status": "active",
      "pin_state": "pinned",
      "round_ids": ["R1A", "R1"],
      "task_ids": ["R1-CPU-PLAY-LIFECYCLE", "R1-LIVE-FOUNDATION", "R1-TIP-FIDELITY"],
      "worktree": "C:/Users/joshs/Projects/tecmo-basketball-port-r1-gameplay-foundation-sol",
      "branch": "codex/r1-gameplay-foundation-sol",
      "base_sha": "6d8f9c7a99a7ce188f1a523247d3a9b9093860fb",
      "last_good_sha": "222d75cfafa9153db1eb44492bf557f11b1a9091",
      "reports_to_session_id": "S-MASTER-001",
      "parent_session_id": null,
      "reported_luna_lineage": [
        "019fc628-0649-7c53-8153-31f8cb75c30d",
        "019fc628-0b32-7e83-b969-b41990b36e9b",
        "019fc63f-dada-7de2-bae3-9e809126ccbe",
        "019fc761-e213-7713-96a1-846a05fed558",
        "019fc765-8d36-7be2-b273-d5e617520061",
        "019fc78a-69e1-7892-82ed-d14a39d37728",
        "019fc89b-05fb-7193-aef0-e483f9306279",
        "019fc8ea-543c-7c11-8cae-64f39cec735f"
      ],
      "recovery_lineage": ["S-SOL-R1-GAMEPLAY-DUP-001"],
      "failure": {
        "count": 1,
        "raw_error_signatures": ["codex_app__create_thread returned: Something went wrong while running this tool; registry inspection proved the authoritative thread was nevertheless created"],
        "retry_session_ids": [],
        "replacement_session_id": null,
        "takeover_confirmed_at": "2026-08-03T05:36:28Z"
      },
      "created_at": "2026-08-03T05:34:46Z",
      "completed_at": null,
      "updated_at": "2026-08-03T20:48:17Z",
      "notes": "CPU+LIVE remain physically staged cleanly at 222d75cf. TIP evidence is personally Sol-accepted with explicit incomplete tie/player-map/trajectory classifications. Master granted exact sequential scene.c/source-map.c, scene-wrapper metadata, two literal TPTI-2 strings, and fixture-only JUMP_CONTEST input adaptations in live_proof_advance_pretip and flow_finish_gameplay_pretip after their frozen neutral-input fixtures failed closed. Research Luna 019fc89b completed/unpinned; one collision-cleared writable Luna 019fc8ea-543c-7c11-8cae-64f39cec735f was created/pinned first attempt on codex/r1-tip-fidelity-luna at exact clean 222d75cf and owns only the current registered set. No main push; master owns staging/main."
    },
    {
      "session_id": "S-SOL-R3-SEASON-DATA-001",
      "thread_id": "019fc822-ac5c-7e21-a212-fc184d0e6a15",
      "title": "Tecmo R3 Season Data Foundation Domain Orchestrator - Sol Max",
      "role": "domain_orchestrator",
      "model": "gpt-5.6-sol",
      "thinking": "max",
      "status": "completed",
      "pin_state": "unpinned",
      "round_ids": ["R3A"],
      "task_ids": ["R3-SEASON-DATA-FOUNDATION"],
      "worktree": "C:/Users/joshs/Projects/tecmo-basketball-port-r3-season-data-foundation-sol",
      "branch": "codex/r3-season-data-foundation-sol",
      "base_sha": "6d8f9c7a99a7ce188f1a523247d3a9b9093860fb",
      "last_good_sha": "f536a19398803742e1a3dc5bb33d8a6ee2968a24",
      "reports_to_session_id": "S-MASTER-001",
      "parent_session_id": null,
      "reported_luna_lineage": ["019fc824-fea9-70b2-a0d0-c0621b217fa5", "019fc825-586c-7250-9e8f-805f2bf8860a", "019fc836-d254-78a0-b3a6-c4003278c2a5", "019fc869-9412-7d72-8534-f81c1d63275b"],
      "recovery_lineage": [],
      "failure": {"count":0,"raw_error_signatures":[],"retry_session_ids":[],"replacement_session_id":null,"takeover_confirmed_at":null},
      "created_at": "2026-08-03T14:59:03Z",
      "completed_at": "2026-08-03T16:53:56Z",
      "updated_at": "2026-08-03T16:53:56Z",
      "notes": "Sol and independent QA terminally accept exact seven-commit lineage through f536a19398803742e1a3dc5bb33d8a6ee2968a24. Authorized ff-only worker-to-domain integration succeeded; registered Sol and worker branches are clean/equal, main/origin remain 6d8f9c7, and master independently verified exact ancestry/order. Final integrated-tip product QA is signed green. All four reported Lunas are completed/unpinned with contexts preserved. Master recorded the task staging-ready at cf3b3a2, then completed/unpinned this bounded Sol at 2026-08-03T16:53:56Z; its branch/worktree remain preserved for later round staging."
    },
    {
      "session_id": "S-SOL-R1A-INTEGRATION-QA-001",
      "thread_id": "019fc8d2-0d1e-78d2-a506-58a5da24db16",
      "title": "Tecmo R1A CPU LIVE Integration QA — Sol Max",
      "role": "integration_orchestrator",
      "model": "gpt-5.6-sol",
      "thinking": "max",
      "status": "completed",
      "pin_state": "unpinned",
      "round_ids": ["R1A"],
      "task_ids": ["R1A-INTEGRATION-QA"],
      "worktree": "C:/Users/joshs/Projects/tecmo-basketball-port-r1a-cpu-live-integration-qa-sol",
      "branch": "codex/r1a-cpu-live-integration-qa-sol",
      "base_sha": "222d75cfafa9153db1eb44492bf557f11b1a9091",
      "last_good_sha": "819b0e5eabca11683786e45474ca60329dff7f5f",
      "reports_to_session_id": "S-MASTER-001",
      "parent_session_id": null,
      "reported_luna_lineage": ["019fc8d6-7a77-79d0-a352-767a228ef478"],
      "recovery_lineage": [],
      "failure": {"count":0,"raw_error_signatures":[],"retry_session_ids":[],"replacement_session_id":null,"takeover_confirmed_at":null},
      "created_at": "2026-08-03T18:10:36Z",
      "completed_at": "2026-08-03T19:54:00Z",
      "updated_at": "2026-08-03T20:01:46Z",
      "notes": "Terminally accepted signed report 819b0e5 over merged candidate 351f446 closed same-Luna P0/P1/P2 at zero after full CPU/LIVE/R3A/R4A combined proof. Master verified SSH signature, exact ancestry and diff, fast-forwarded current main from bcacd5b, non-force pushed, and verified local/tracking/live remote exact 819b0e5. After durable control commit f4aaf30, master unpinned this completed Sol; branch/worktree are preserved."
    },
    {
      "session_id": "S-SOL-R3A-INTEGRATION-QA-001",
      "thread_id": "019fc8d2-986a-7643-978f-099070876dfb",
      "title": "Tecmo R3A Season Data Integration QA — Sol Max",
      "role": "integration_orchestrator",
      "model": "gpt-5.6-sol",
      "thinking": "max",
      "status": "completed",
      "pin_state": "unpinned",
      "round_ids": ["R3A"],
      "task_ids": ["R3A-INTEGRATION-QA"],
      "worktree": "C:/Users/joshs/Projects/tecmo-basketball-port-r3a-season-data-integration-qa-sol",
      "branch": "codex/r3a-season-data-integration-qa-sol",
      "base_sha": "f536a19398803742e1a3dc5bb33d8a6ee2968a24",
      "last_good_sha": "dd096cb23a5fe7d755615fcaaadc0aa1d9b1509d",